{
  "featured": [
    "semantic-chunking",
    "embedding-utils",
    "shrinkray",
    "ai-assistant-skills",
    "pixel-banner",
    "mcp-sqlite",
    "llm-distillery",
    "fast-topic-analysis"
  ],
  "pinned": [],
  "hidden": [
    "kdm-cards",
    "card-generator-sob",
    "clover-quilt-designer",
    "wdw-adr-checker",
    "caps-left-right",
    "*-personal",
    "dotfiles*"
  ],
  "hideTopics": ["not-portfolio", "private-project"],
  "order": {}
}
